{"id":"PRP-920009","schemaVersion":"0.1.0","recordVersion":"0.1.0","revision":0,"status":"Review","createdAt":"2026-09-24T10:00:00Z","createdBy":"example-author","updatedAt":"2026-09-24T10:00:00Z","updatedBy":"example-reviewer","sourceLinks":[{"sourceReferenceId":"SRC-920001","sourceClass":"N","supportedClaim":"Fictional property definition.","usageType":"citation","verificationStatus":"Reviewed"}],"changeSummary":"Fictional validation fixture.","name":"Example Property Iota","description":"Fictional property meaning used only for contract validation.","allowedValueTypes":["quantity"],"allowedUnitIds":["UNT-900001"]}
