{"id":"PRP-920002","schemaVersion":"0.1.0","recordVersion":"0.1.0","revision":0,"status":"Draft","createdAt":"2026-09-24T10:00:00Z","createdBy":"example-author","updatedAt":"2026-09-24T10:00:00Z","updatedBy":"example-author","sourceLinks":[],"changeSummary":"Fictional validation fixture.","name":"Example Property Beta","description":"Fictional property meaning used only for contract validation.","allowedValueTypes":["valueRange"],"allowedUnitIds":["UNT-900001"]}
